{
  "$schema": "https://json-schema.org/draft/2020-12/schema",
  "type": "object",
  "properties": {
    "contractVersion": {
      "type": "string",
      "const": "btb-rebuild.v1"
    },
    "modelRegime": {
      "type": "string",
      "const": "BTB_RB1_20261018"
    },
    "matchKey": {
      "type": "string"
    },
    "asOf": {
      "type": "string",
      "format": "date-time",
      "pattern": "^(?:(?:\\d\\d[2468][048]|\\d\\d[13579][26]|\\d\\d0[48]|[02468][048]00|[13579][26]00)-02-29|\\d{4}-(?:(?:0[13578]|1[02])-(?:0[1-9]|[12]\\d|3[01])|(?:0[469]|11)-(?:0[1-9]|[12]\\d|30)|(?:02)-(?:0[1-9]|1\\d|2[0-8])))T(?:(?:[01]\\d|2[0-3]):[0-5]\\d(?::[0-5]\\d(?:\\.\\d+)?)?(?:Z))$"
    },
    "availability": {
      "type": "string",
      "enum": [
        "ACTIVE",
        "WAITING_DATA",
        "UNAVAILABLE",
        "NOT_STARTED"
      ]
    },
    "reason": {
      "type": "string"
    },
    "current": {
      "anyOf": [
        {
          "type": "object",
          "properties": {
            "decisionId": {
              "type": "string",
              "pattern": "^[A-F0-9]{32}$"
            },
            "market": {
              "type": "string"
            },
            "quote": {
              "type": "string",
              "pattern": "^-?\\d+(?:\\.\\d+)?$"
            },
            "stars": {
              "type": "integer",
              "minimum": 1,
              "maximum": 5
            },
            "consistencyScore": {
              "type": "string",
              "pattern": "^-?\\d+(?:\\.\\d+)?$"
            },
            "validUntil": {
              "type": "string",
              "format": "date-time",
              "pattern": "^(?:(?:\\d\\d[2468][048]|\\d\\d[13579][26]|\\d\\d0[48]|[02468][048]00|[13579][26]00)-02-29|\\d{4}-(?:(?:0[13578]|1[02])-(?:0[1-9]|[12]\\d|3[01])|(?:0[469]|11)-(?:0[1-9]|[12]\\d|30)|(?:02)-(?:0[1-9]|1\\d|2[0-8])))T(?:(?:[01]\\d|2[0-3]):[0-5]\\d(?::[0-5]\\d(?:\\.\\d+)?)?(?:Z))$"
            }
          },
          "required": [
            "decisionId",
            "market",
            "quote",
            "stars",
            "consistencyScore",
            "validUntil"
          ],
          "additionalProperties": false
        },
        {
          "type": "null"
        }
      ]
    },
    "history": {
      "type": "array",
      "items": {
        "type": "object",
        "properties": {
          "market": {
            "type": "string"
          },
          "admitted": {
            "type": "boolean"
          },
          "selected": {
            "type": "boolean"
          },
          "reason": {
            "type": "string"
          },
          "quote": {
            "anyOf": [
              {
                "type": "string",
                "pattern": "^-?\\d+(?:\\.\\d+)?$"
              },
              {
                "type": "null"
              }
            ]
          },
          "quoteAt": {
            "anyOf": [
              {
                "type": "string",
                "format": "date-time",
                "pattern": "^(?:(?:\\d\\d[2468][048]|\\d\\d[13579][26]|\\d\\d0[48]|[02468][048]00|[13579][26]00)-02-29|\\d{4}-(?:(?:0[13578]|1[02])-(?:0[1-9]|[12]\\d|3[01])|(?:0[469]|11)-(?:0[1-9]|[12]\\d|30)|(?:02)-(?:0[1-9]|1\\d|2[0-8])))T(?:(?:[01]\\d|2[0-3]):[0-5]\\d(?::[0-5]\\d(?:\\.\\d+)?)?(?:Z))$"
              },
              {
                "type": "null"
              }
            ]
          },
          "marketOpen": {
            "anyOf": [
              {
                "type": "boolean"
              },
              {
                "type": "null"
              }
            ]
          },
          "consistencyScore": {
            "anyOf": [
              {
                "type": "string",
                "pattern": "^-?\\d+(?:\\.\\d+)?$"
              },
              {
                "type": "null"
              }
            ]
          },
          "stars": {
            "type": "integer",
            "minimum": 1,
            "maximum": 5
          },
          "poolWins": {
            "type": "integer",
            "minimum": 0,
            "maximum": 9007199254740991
          },
          "poolTotal": {
            "type": "integer",
            "minimum": 0,
            "maximum": 9007199254740991
          },
          "votesSupport": {
            "type": "integer",
            "minimum": 0,
            "maximum": 9007199254740991
          },
          "votesUsed": {
            "type": "integer",
            "minimum": 0,
            "maximum": 9007199254740991
          },
          "directionConflict": {
            "type": "boolean"
          },
          "dissent": {
            "type": "boolean"
          },
          "votes": {
            "maxItems": 3,
            "type": "array",
            "items": {
              "type": "object",
              "properties": {
                "startsAt": {
                  "type": "string",
                  "format": "date-time",
                  "pattern": "^(?:(?:\\d\\d[2468][048]|\\d\\d[13579][26]|\\d\\d0[48]|[02468][048]00|[13579][26]00)-02-29|\\d{4}-(?:(?:0[13578]|1[02])-(?:0[1-9]|[12]\\d|3[01])|(?:0[469]|11)-(?:0[1-9]|[12]\\d|30)|(?:02)-(?:0[1-9]|1\\d|2[0-8])))T(?:(?:[01]\\d|2[0-3]):[0-5]\\d(?::[0-5]\\d(?:\\.\\d+)?)?(?:Z))$"
                },
                "endsAt": {
                  "type": "string",
                  "format": "date-time",
                  "pattern": "^(?:(?:\\d\\d[2468][048]|\\d\\d[13579][26]|\\d\\d0[48]|[02468][048]00|[13579][26]00)-02-29|\\d{4}-(?:(?:0[13578]|1[02])-(?:0[1-9]|[12]\\d|3[01])|(?:0[469]|11)-(?:0[1-9]|[12]\\d|30)|(?:02)-(?:0[1-9]|1\\d|2[0-8])))T(?:(?:[01]\\d|2[0-3]):[0-5]\\d(?::[0-5]\\d(?:\\.\\d+)?)?(?:Z))$"
                },
                "supports": {
                  "type": "boolean"
                },
                "estimated": {
                  "type": "boolean"
                },
                "home": {
                  "type": "string",
                  "pattern": "^-?\\d+(?:\\.\\d+)?$"
                },
                "away": {
                  "type": "string",
                  "pattern": "^-?\\d+(?:\\.\\d+)?$"
                },
                "total": {
                  "type": "string",
                  "pattern": "^-?\\d+(?:\\.\\d+)?$"
                }
              },
              "required": [
                "startsAt",
                "endsAt",
                "supports",
                "estimated",
                "home",
                "away",
                "total"
              ],
              "additionalProperties": false
            }
          },
          "caps": {
            "type": "object",
            "properties": {
              "sample": {
                "type": "integer",
                "minimum": 0,
                "maximum": 9007199254740991
              },
              "direction": {
                "type": "integer",
                "minimum": 0,
                "maximum": 9007199254740991
              },
              "timing": {
                "type": "integer",
                "minimum": 0,
                "maximum": 9007199254740991
              },
              "xg": {
                "type": "integer",
                "minimum": 0,
                "maximum": 9007199254740991
              },
              "time_goals": {
                "type": "integer",
                "minimum": 0,
                "maximum": 9007199254740991
              }
            },
            "required": [
              "sample",
              "direction",
              "timing",
              "xg",
              "time_goals"
            ],
            "additionalProperties": false
          },
          "decisionId": {
            "type": "string",
            "pattern": "^[A-F0-9]{32}$"
          },
          "previousDecisionId": {
            "anyOf": [
              {
                "type": "string",
                "pattern": "^[A-F0-9]{32}$"
              },
              {
                "type": "null"
              }
            ]
          },
          "episodeId": {
            "type": "string",
            "pattern": "^[A-F0-9]{32}$"
          },
          "matchKey": {
            "type": "string"
          },
          "homeTeam": {
            "type": "string"
          },
          "awayTeam": {
            "type": "string"
          },
          "publishedAt": {
            "type": "string",
            "format": "date-time",
            "pattern": "^(?:(?:\\d\\d[2468][048]|\\d\\d[13579][26]|\\d\\d0[48]|[02468][048]00|[13579][26]00)-02-29|\\d{4}-(?:(?:0[13578]|1[02])-(?:0[1-9]|[12]\\d|3[01])|(?:0[469]|11)-(?:0[1-9]|[12]\\d|30)|(?:02)-(?:0[1-9]|1\\d|2[0-8])))T(?:(?:[01]\\d|2[0-3]):[0-5]\\d(?::[0-5]\\d(?:\\.\\d+)?)?(?:Z))$"
          },
          "minute": {
            "type": "integer",
            "minimum": 0,
            "maximum": 9007199254740991
          },
          "homeScore": {
            "type": "integer",
            "minimum": 0,
            "maximum": 9007199254740991
          },
          "awayScore": {
            "type": "integer",
            "minimum": 0,
            "maximum": 9007199254740991
          },
          "leaders": {
            "type": "array",
            "items": {
              "type": "object",
              "properties": {
                "home": {
                  "type": "integer",
                  "minimum": 0,
                  "maximum": 9007199254740991
                },
                "away": {
                  "type": "integer",
                  "minimum": 0,
                  "maximum": 9007199254740991
                }
              },
              "required": [
                "home",
                "away"
              ],
              "additionalProperties": false
            }
          },
          "countUnit": {
            "type": "string"
          },
          "physicalUniqueness": {
            "type": "string"
          },
          "result": {
            "type": "object",
            "properties": {
              "state": {
                "type": "string",
                "enum": [
                  "WIN",
                  "LOSS",
                  "VOID",
                  "PENDING",
                  "UNRESOLVED"
                ]
              },
              "revision": {
                "type": "integer",
                "exclusiveMinimum": 0,
                "maximum": 9007199254740991
              },
              "net": {
                "anyOf": [
                  {
                    "type": "string",
                    "pattern": "^-?\\d+(?:\\.\\d+)?$"
                  },
                  {
                    "type": "null"
                  }
                ]
              }
            },
            "required": [
              "state",
              "revision",
              "net"
            ],
            "additionalProperties": false
          }
        },
        "required": [
          "market",
          "admitted",
          "selected",
          "reason",
          "quote",
          "quoteAt",
          "consistencyScore",
          "stars",
          "poolWins",
          "poolTotal",
          "votesSupport",
          "votesUsed",
          "directionConflict",
          "dissent",
          "votes",
          "caps",
          "decisionId",
          "previousDecisionId",
          "episodeId",
          "matchKey",
          "homeTeam",
          "awayTeam",
          "publishedAt",
          "minute",
          "homeScore",
          "awayScore",
          "leaders",
          "countUnit",
          "physicalUniqueness",
          "result"
        ],
        "additionalProperties": false
      }
    },
    "candidates": {
      "maxItems": 19,
      "type": "array",
      "items": {
        "type": "object",
        "properties": {
          "market": {
            "type": "string"
          },
          "admitted": {
            "type": "boolean"
          },
          "selected": {
            "type": "boolean"
          },
          "reason": {
            "type": "string"
          },
          "quote": {
            "anyOf": [
              {
                "type": "string",
                "pattern": "^-?\\d+(?:\\.\\d+)?$"
              },
              {
                "type": "null"
              }
            ]
          },
          "quoteAt": {
            "anyOf": [
              {
                "type": "string",
                "format": "date-time",
                "pattern": "^(?:(?:\\d\\d[2468][048]|\\d\\d[13579][26]|\\d\\d0[48]|[02468][048]00|[13579][26]00)-02-29|\\d{4}-(?:(?:0[13578]|1[02])-(?:0[1-9]|[12]\\d|3[01])|(?:0[469]|11)-(?:0[1-9]|[12]\\d|30)|(?:02)-(?:0[1-9]|1\\d|2[0-8])))T(?:(?:[01]\\d|2[0-3]):[0-5]\\d(?::[0-5]\\d(?:\\.\\d+)?)?(?:Z))$"
              },
              {
                "type": "null"
              }
            ]
          },
          "marketOpen": {
            "anyOf": [
              {
                "type": "boolean"
              },
              {
                "type": "null"
              }
            ]
          },
          "consistencyScore": {
            "anyOf": [
              {
                "type": "string",
                "pattern": "^-?\\d+(?:\\.\\d+)?$"
              },
              {
                "type": "null"
              }
            ]
          },
          "stars": {
            "type": "integer",
            "minimum": 0,
            "maximum": 5
          },
          "poolWins": {
            "type": "integer",
            "minimum": 0,
            "maximum": 9007199254740991
          },
          "poolTotal": {
            "type": "integer",
            "minimum": 0,
            "maximum": 9007199254740991
          },
          "votesSupport": {
            "type": "integer",
            "minimum": 0,
            "maximum": 9007199254740991
          },
          "votesUsed": {
            "type": "integer",
            "minimum": 0,
            "maximum": 9007199254740991
          },
          "directionConflict": {
            "type": "boolean"
          },
          "dissent": {
            "type": "boolean"
          },
          "votes": {
            "maxItems": 3,
            "type": "array",
            "items": {
              "type": "object",
              "properties": {
                "startsAt": {
                  "type": "string",
                  "format": "date-time",
                  "pattern": "^(?:(?:\\d\\d[2468][048]|\\d\\d[13579][26]|\\d\\d0[48]|[02468][048]00|[13579][26]00)-02-29|\\d{4}-(?:(?:0[13578]|1[02])-(?:0[1-9]|[12]\\d|3[01])|(?:0[469]|11)-(?:0[1-9]|[12]\\d|30)|(?:02)-(?:0[1-9]|1\\d|2[0-8])))T(?:(?:[01]\\d|2[0-3]):[0-5]\\d(?::[0-5]\\d(?:\\.\\d+)?)?(?:Z))$"
                },
                "endsAt": {
                  "type": "string",
                  "format": "date-time",
                  "pattern": "^(?:(?:\\d\\d[2468][048]|\\d\\d[13579][26]|\\d\\d0[48]|[02468][048]00|[13579][26]00)-02-29|\\d{4}-(?:(?:0[13578]|1[02])-(?:0[1-9]|[12]\\d|3[01])|(?:0[469]|11)-(?:0[1-9]|[12]\\d|30)|(?:02)-(?:0[1-9]|1\\d|2[0-8])))T(?:(?:[01]\\d|2[0-3]):[0-5]\\d(?::[0-5]\\d(?:\\.\\d+)?)?(?:Z))$"
                },
                "supports": {
                  "type": "boolean"
                },
                "estimated": {
                  "type": "boolean"
                },
                "home": {
                  "type": "string",
                  "pattern": "^-?\\d+(?:\\.\\d+)?$"
                },
                "away": {
                  "type": "string",
                  "pattern": "^-?\\d+(?:\\.\\d+)?$"
                },
                "total": {
                  "type": "string",
                  "pattern": "^-?\\d+(?:\\.\\d+)?$"
                }
              },
              "required": [
                "startsAt",
                "endsAt",
                "supports",
                "estimated",
                "home",
                "away",
                "total"
              ],
              "additionalProperties": false
            }
          },
          "caps": {
            "type": "object",
            "properties": {
              "sample": {
                "type": "integer",
                "minimum": 0,
                "maximum": 9007199254740991
              },
              "direction": {
                "type": "integer",
                "minimum": 0,
                "maximum": 9007199254740991
              },
              "timing": {
                "type": "integer",
                "minimum": 0,
                "maximum": 9007199254740991
              },
              "xg": {
                "type": "integer",
                "minimum": 0,
                "maximum": 9007199254740991
              },
              "time_goals": {
                "type": "integer",
                "minimum": 0,
                "maximum": 9007199254740991
              }
            },
            "required": [
              "sample",
              "direction",
              "timing",
              "xg",
              "time_goals"
            ],
            "additionalProperties": false
          }
        },
        "required": [
          "market",
          "admitted",
          "selected",
          "reason",
          "quote",
          "quoteAt",
          "consistencyScore",
          "stars",
          "poolWins",
          "poolTotal",
          "votesSupport",
          "votesUsed",
          "directionConflict",
          "dissent",
          "votes",
          "caps"
        ],
        "additionalProperties": false
      }
    },
    "jinx": {
      "type": "object",
      "properties": {
        "source": {
          "type": "string",
          "const": "BACKEND"
        },
        "decisionId": {
          "anyOf": [
            {
              "type": "string"
            },
            {
              "type": "null"
            }
          ]
        },
        "reason": {
          "type": "string"
        },
        "summary": {
          "type": "string"
        }
      },
      "required": [
        "source",
        "decisionId",
        "reason",
        "summary"
      ],
      "additionalProperties": false
    }
  },
  "required": [
    "contractVersion",
    "modelRegime",
    "matchKey",
    "asOf",
    "availability",
    "reason",
    "current",
    "history",
    "candidates",
    "jinx"
  ],
  "additionalProperties": false
}
