{
  "contractVersion": "btb-rebuild.v1",
  "modelRegime": "BTB_RB1_20261018",
  "matchKey": "2026-10-20:17:13:00:00",
  "asOf": "2026-10-20T12:00:00.000Z",
  "availability": "ACTIVE",
  "reason": "ACTIVE",
  "current": {
    "decisionId": "11111111111111111111111111111111",
    "market": "Ms15a",
    "quote": "2.25",
    "stars": 3,
    "consistencyScore": "81",
    "validUntil": "2026-10-20T12:00:10.000Z"
  },
  "history": [
    {
      "decisionId": "11111111111111111111111111111111",
      "previousDecisionId": null,
      "episodeId": "33333333333333333333333333333333",
      "matchKey": "2026-10-20:17:13:00:00",
      "homeTeam": "Home",
      "awayTeam": "Away",
      "publishedAt": "2026-10-20T11:58:00.000Z",
      "minute": 60,
      "homeScore": 0,
      "awayScore": 0,
      "market": "Ms15a",
      "admitted": true,
      "selected": true,
      "reason": "",
      "quote": "2.123456789012345678901234567890123",
      "quoteAt": "2026-10-20T11:58:00.000Z",
      "consistencyScore": "81",
      "stars": 3,
      "poolWins": 36,
      "poolTotal": 40,
      "votesSupport": 2,
      "votesUsed": 2,
      "directionConflict": false,
      "dissent": false,
      "votes": [
        {
          "startsAt": "2026-10-20T11:54:00.000Z",
          "endsAt": "2026-10-20T11:56:00.000Z",
          "supports": true,
          "estimated": true,
          "home": "2",
          "away": "0.5",
          "total": "2.5"
        },
        {
          "startsAt": "2026-10-20T11:56:00.000Z",
          "endsAt": "2026-10-20T11:58:00.000Z",
          "supports": true,
          "estimated": true,
          "home": "2",
          "away": "0.5",
          "total": "2.5"
        }
      ],
      "caps": {
        "sample": 3,
        "direction": 5,
        "timing": 4,
        "xg": 4,
        "time_goals": 5
      },
      "leaders": [
        {
          "home": 2,
          "away": 0
        }
      ],
      "countUnit": "SAP_REFERENCE_RECORD",
      "physicalUniqueness": "UNPROVEN",
      "result": {
        "state": "PENDING",
        "revision": 1,
        "net": null
      }
    }
  ],
  "candidates": [
    {
      "market": "Ms05a",
      "admitted": false,
      "selected": false,
      "reason": "MARKET_CLOSED",
      "quote": null,
      "quoteAt": null,
      "consistencyScore": null,
      "stars": 0,
      "poolWins": 0,
      "poolTotal": 0,
      "votesSupport": 0,
      "votesUsed": 0,
      "directionConflict": false,
      "dissent": false,
      "votes": [],
      "caps": {
        "sample": 0,
        "direction": 0,
        "timing": 0,
        "xg": 0,
        "time_goals": 0
      }
    },
    {
      "market": "Ms05u",
      "admitted": false,
      "selected": false,
      "reason": "MARKET_CLOSED",
      "quote": null,
      "quoteAt": null,
      "consistencyScore": null,
      "stars": 0,
      "poolWins": 0,
      "poolTotal": 0,
      "votesSupport": 0,
      "votesUsed": 0,
      "directionConflict": false,
      "dissent": false,
      "votes": [],
      "caps": {
        "sample": 0,
        "direction": 0,
        "timing": 0,
        "xg": 0,
        "time_goals": 0
      }
    },
    {
      "market": "Ms15a",
      "admitted": true,
      "selected": true,
      "reason": "",
      "quote": "2.25",
      "quoteAt": "2026-10-20T11:59:55.000Z",
      "consistencyScore": "81",
      "stars": 3,
      "poolWins": 36,
      "poolTotal": 40,
      "votesSupport": 2,
      "votesUsed": 2,
      "directionConflict": false,
      "dissent": false,
      "votes": [
        {
          "startsAt": "2026-10-20T11:54:00.000Z",
          "endsAt": "2026-10-20T11:56:00.000Z",
          "supports": true,
          "estimated": true,
          "home": "2",
          "away": "0.5",
          "total": "2.5"
        },
        {
          "startsAt": "2026-10-20T11:56:00.000Z",
          "endsAt": "2026-10-20T11:59:55.000Z",
          "supports": true,
          "estimated": true,
          "home": "2",
          "away": "0.5",
          "total": "2.5"
        }
      ],
      "caps": {
        "sample": 3,
        "direction": 5,
        "timing": 4,
        "xg": 4,
        "time_goals": 5
      }
    },
    {
      "market": "Ms15u",
      "admitted": false,
      "selected": false,
      "reason": "MARKET_CLOSED",
      "quote": null,
      "quoteAt": null,
      "consistencyScore": null,
      "stars": 0,
      "poolWins": 0,
      "poolTotal": 0,
      "votesSupport": 0,
      "votesUsed": 0,
      "directionConflict": false,
      "dissent": false,
      "votes": [],
      "caps": {
        "sample": 0,
        "direction": 0,
        "timing": 0,
        "xg": 0,
        "time_goals": 0
      }
    },
    {
      "market": "Ms25a",
      "admitted": false,
      "selected": false,
      "reason": "MARKET_CLOSED",
      "quote": null,
      "quoteAt": null,
      "consistencyScore": null,
      "stars": 0,
      "poolWins": 0,
      "poolTotal": 0,
      "votesSupport": 0,
      "votesUsed": 0,
      "directionConflict": false,
      "dissent": false,
      "votes": [],
      "caps": {
        "sample": 0,
        "direction": 0,
        "timing": 0,
        "xg": 0,
        "time_goals": 0
      }
    },
    {
      "market": "Ms25u",
      "admitted": false,
      "selected": false,
      "reason": "MARKET_CLOSED",
      "quote": null,
      "quoteAt": null,
      "consistencyScore": null,
      "stars": 0,
      "poolWins": 0,
      "poolTotal": 0,
      "votesSupport": 0,
      "votesUsed": 0,
      "directionConflict": false,
      "dissent": false,
      "votes": [],
      "caps": {
        "sample": 0,
        "direction": 0,
        "timing": 0,
        "xg": 0,
        "time_goals": 0
      }
    },
    {
      "market": "Ms35a",
      "admitted": false,
      "selected": false,
      "reason": "MARKET_CLOSED",
      "quote": null,
      "quoteAt": null,
      "consistencyScore": null,
      "stars": 0,
      "poolWins": 0,
      "poolTotal": 0,
      "votesSupport": 0,
      "votesUsed": 0,
      "directionConflict": false,
      "dissent": false,
      "votes": [],
      "caps": {
        "sample": 0,
        "direction": 0,
        "timing": 0,
        "xg": 0,
        "time_goals": 0
      }
    },
    {
      "market": "Ms35u",
      "admitted": false,
      "selected": false,
      "reason": "MARKET_CLOSED",
      "quote": null,
      "quoteAt": null,
      "consistencyScore": null,
      "stars": 0,
      "poolWins": 0,
      "poolTotal": 0,
      "votesSupport": 0,
      "votesUsed": 0,
      "directionConflict": false,
      "dissent": false,
      "votes": [],
      "caps": {
        "sample": 0,
        "direction": 0,
        "timing": 0,
        "xg": 0,
        "time_goals": 0
      }
    },
    {
      "market": "Ms45a",
      "admitted": false,
      "selected": false,
      "reason": "MARKET_CLOSED",
      "quote": null,
      "quoteAt": null,
      "consistencyScore": null,
      "stars": 0,
      "poolWins": 0,
      "poolTotal": 0,
      "votesSupport": 0,
      "votesUsed": 0,
      "directionConflict": false,
      "dissent": false,
      "votes": [],
      "caps": {
        "sample": 0,
        "direction": 0,
        "timing": 0,
        "xg": 0,
        "time_goals": 0
      }
    },
    {
      "market": "Ms45u",
      "admitted": false,
      "selected": false,
      "reason": "MARKET_CLOSED",
      "quote": null,
      "quoteAt": null,
      "consistencyScore": null,
      "stars": 0,
      "poolWins": 0,
      "poolTotal": 0,
      "votesSupport": 0,
      "votesUsed": 0,
      "directionConflict": false,
      "dissent": false,
      "votes": [],
      "caps": {
        "sample": 0,
        "direction": 0,
        "timing": 0,
        "xg": 0,
        "time_goals": 0
      }
    },
    {
      "market": "Ms1",
      "admitted": false,
      "selected": false,
      "reason": "MARKET_CLOSED",
      "quote": null,
      "quoteAt": null,
      "consistencyScore": null,
      "stars": 0,
      "poolWins": 0,
      "poolTotal": 0,
      "votesSupport": 0,
      "votesUsed": 0,
      "directionConflict": false,
      "dissent": false,
      "votes": [],
      "caps": {
        "sample": 0,
        "direction": 0,
        "timing": 0,
        "xg": 0,
        "time_goals": 0
      }
    },
    {
      "market": "MsX",
      "admitted": false,
      "selected": false,
      "reason": "MARKET_CLOSED",
      "quote": null,
      "quoteAt": null,
      "consistencyScore": null,
      "stars": 0,
      "poolWins": 0,
      "poolTotal": 0,
      "votesSupport": 0,
      "votesUsed": 0,
      "directionConflict": false,
      "dissent": false,
      "votes": [],
      "caps": {
        "sample": 0,
        "direction": 0,
        "timing": 0,
        "xg": 0,
        "time_goals": 0
      }
    },
    {
      "market": "Ms2",
      "admitted": false,
      "selected": false,
      "reason": "MARKET_CLOSED",
      "quote": null,
      "quoteAt": null,
      "consistencyScore": null,
      "stars": 0,
      "poolWins": 0,
      "poolTotal": 0,
      "votesSupport": 0,
      "votesUsed": 0,
      "directionConflict": false,
      "dissent": false,
      "votes": [],
      "caps": {
        "sample": 0,
        "direction": 0,
        "timing": 0,
        "xg": 0,
        "time_goals": 0
      }
    },
    {
      "market": "Ms1X",
      "admitted": false,
      "selected": false,
      "reason": "MARKET_CLOSED",
      "quote": null,
      "quoteAt": null,
      "consistencyScore": null,
      "stars": 0,
      "poolWins": 0,
      "poolTotal": 0,
      "votesSupport": 0,
      "votesUsed": 0,
      "directionConflict": false,
      "dissent": false,
      "votes": [],
      "caps": {
        "sample": 0,
        "direction": 0,
        "timing": 0,
        "xg": 0,
        "time_goals": 0
      }
    },
    {
      "market": "MsX2",
      "admitted": false,
      "selected": false,
      "reason": "MARKET_CLOSED",
      "quote": null,
      "quoteAt": null,